Philippines,<NA>,The Conjugal Dictatorship of Ferdinand and Imelda Marcos,Primitivo Mijares,1976.0,<NA>,<NA>,Non-fiction,Banned for during the Martial Law period due to being critical of the administration of President Ferdinand Marcos.[210],,
Philippines,<NA>,The Untold Story of Imelda Marcos,Carmen Pedrosa,,<NA>,<NA>,Biography,"Banned in 1972, shortly after the start of the Martial Law period under President Ferdinand Marcos. The ""unauthorized"" biography was banned for the depiction of First Lady Imelda Marcos' extravagance.[210]",,
Philippines,<NA>,"Tawid diwa sa pananagisag ni Bienvenido Lumbera: Ang Bayan, ang Nanunulat at ang Magasing Sagisag sa Imahinatibong Yugto ng Batas Militar 1975–1979",Dexter Cayanes,,<NA>,<NA>,,"Research on the literary works by Bienvenido Lumbera, who was imprisoned during the Martial Law period under President Ferdinand Marcos. Banned in 2022 by the Commission on the Filipino Language (KWF) from public libraries and schools for being ""anti‑government"".[211]",,
Philippines,<NA>,Teatro Political Dos,Malou Jacob,,<NA>,<NA>,,"Banned in 2022 by the Commission on the Filipino Language (KWF) from public libraries and schools for being ""anti‑government"". The works are previously published under the auspices of the KWF.[211]",,
Philippines,<NA>,Kalatas: Mga Kuwentong Bayan at Kuwentong Buhay,Rommel Rodriguez,,<NA>,<NA>,,"Banned in 2022 by the Commission on the Filipino Language (KWF) from public libraries and schools for being ""anti‑government"". The works are previously published under the auspices of the KWF.[211]",,
Philippines,<NA>,May Hadlang ang Umaga,Don Pagusara,,<NA>,<NA>,,"Banned in 2022 by the Commission on the Filipino Language (KWF) from public libraries and schools for being ""anti‑government"". The works are previously published under the auspices of the KWF.[211]",,
Philippines,<NA>,Labas: Mga Palabas ng Sentro,Reuel Aguilla,,<NA>,<NA>,,"Banned in 2022 by the Commission on the Filipino Language (KWF) from public libraries and schools for being ""anti‑government[211]",,
Poland,<NA>,Mirror of the Polish Crown (1618),Sebastian Miczyński,1618,<NA>,<NA>,Anti‑Semitic pamphlet,"Because this pamphlet published in 1618 was one of the causes of the anti-Jewish riots in Cracow, it was banned by Sigismund III Vasa.[212]",,
Poland,<NA>,Mein Kampf (1925),Adolf Hitler,1925,<NA>,<NA>,Political manifesto,Banned until 1992.[128],,
Portugal,<NA>,História do Mundo para as Crianças [pt],Monteiro Lobato,1933,<NA>,<NA>,Novel,"The book was banned by the Portuguese government without any clear reason. According to the author, one possible reason was because he was from the ""current of thought what claims that the discovery of Brazil happened 'by random'"" or by the fact he ""have registered the history of the 1600 years cut to the Arabian navy by Vasco da Gama"".[213]",,
Portugal,<NA>,New Portuguese Letters (Novas Cartas Portuguesas),"Maria Isabel Barreno, Maria Teresa Horta and Maria Velho da Costa",1972,<NA>,<NA>,,"Banned as ""pornographic and an offense to public morals""; authors charged with ""abuse of the freedom of the press"" and ""outrage to public decency""; uplifted after the Carnation Revolution in 1974.[214]",,
Qatar,<NA>,The Boys,Garth Ennis,2012,<NA>,<NA>,Comic book series,Banned in Qatar in 2012.[215][further explanation needed],,
Qatar,<NA>,The Man Who Wouldn't Stand Up (2012),Jacob M. Appel,2012,<NA>,<NA>,Novel,Banned in Qatar in 2014 for its depiction of Islam.[216],,
Qatar,<NA>,Love Comes Later (2014),Mohanalakshmi Rajakumar,2014,<NA>,<NA>,Novel,Banned in Qatar.[217],,
Roman Empire,<NA>,Thalia,Arius (AD 250 or 256 ‍–‍ 336),,<NA>,<NA>,"Theological tract, partly in verse","Banned in the Roman Empire in the 330's+ for contradicting Trinitarianism. All of Arius writings were ordered burned and Arius exiled, and presumably assassinated for his writings.[218] Banned by the Catholic Church for the next thousand plus years.[citation needed]",,
Russia,<NA>,Quran,Unknown,,<NA>,<NA>,Religious text,"In 2013, a Russian court in Novorossiysk banned a translation of the Quran by Elmir Kuliyev under the country's 'extremism' laws.[219] The ban was soon overturned.[220]",,
Russia,<NA>,Rights of Man (1791),Thomas Paine,1791.0,<NA>,<NA>,Political theory,Banned in Tsarist Russia after the Decembrist revolt.[221],,
Russia,<NA>,The Communist Manifesto,Karl Marx and Friedrich Engels,1848.0,<NA>,<NA>,Political Manifesto,"Prohibited by several countries, including Tsarist Russia.[125]",,
Russia,<NA>,Looking Backward,Edward Bellamy,1888.0,<NA>,<NA>,Novel,Prohibited by the Tsarist Russian censors.[222],,
Russia,<NA>,The Protocols of the Elders of Zion (1903),Unknown,1903.0,<NA>,<NA>,"A forgery, portraying a Jewish conspiracy to take over the world","Banned in various libraries and many attempts to ban in various nations, such as in Russia.[citation needed]",,
Russia,<NA>,Mein Kampf (1925),Adolf Hitler,1925.0,<NA>,<NA>,Political manifesto,Banned in the Russian Federation as extremist.[223],,
Russia,<NA>,Apocalypse Culture,Adam Parfrey,1987.0,<NA>,<NA>,Non-fiction,"Collection of articles, interviews and documents exploring various marginal aspects of 20th century culture. In 2006, shortly after Ultra.Kultura (Ультра.Культура) published a Russian edition combining Apocalypse Culture and Apocalypse Culture II as a single volume titled Культура времен Апокалипсиса, the volume was banned by Kremlin decree.",,
Russia,<NA>,Siege,James Mason,1992.0,<NA>,<NA>,Non-fiction,"Anthology of essays advocating for neo-Nazi revolution through terrorism. Banned on August 14, 2023.[224]",,
Russia,Soviet Union,Works,Friedrich Nietzsche,1872–1901,<NA>,<NA>,Non-fiction,"Banned in Soviet Union since 1923 on proposal of Nadezhda Krupskaya. All works were placed on the list of forbidden books and kept in libraries only for restricted, authorized use.[225]",,
Russia,Soviet Union,Animal Farm,George Orwell,1945,<NA>,<NA>,Political novella,"Completed in 1943, Orwell found that no publisher would print the book, due to its criticism of the USSR, an important ally of Britain in the War.[226] Once published, the book was banned in the USSR and other communist countries.[227]",,
Russia,Soviet Union,Nineteen Eighty-Four (1949),George Orwell,1949,<NA>,<NA>,Novel,"Banned by the Soviet Union[128] in 1950, as Stalin understood that it was a satire based on his leadership. It was not until 1990 that the Soviet Union legalised the book and it was re-released after editing.[228]",,
Russia,Soviet Union,Doctor Zhivago,Boris Pasternak,1955–1988,<NA>,<NA>,Novel,"Banned in the Soviet Union until 1988 for criticizing life in Russia after the Russian Revolution. When its author, Boris Pasternak, won the Nobel Prize for Literature in 1958, he was forced to reject it under government pressure.[128]",,
Russia,Soviet Union,One Day in the Life of Ivan Denisovich (1962),Alexander Solzhenitsyn,1962,<NA>,<NA>,Novel,Banned from publication in the Soviet Union in 1964.[163],,
Russia,Soviet Union,The First Circle (1968),Aleksandr Solzhenitsyn,1968,<NA>,<NA>,Novel,"After Nikita Khrushchev was removed from power in 1964, all extant and forthcoming works by Aleksandr Solzhenitsyn were banned in the Soviet Union. This work details the lives of scientists forced to work in a Stalinist research center.[229]",,
Russia,Soviet Union,The Gulag Archipelago (1973),Aleksandr Solzhenitsyn,1973,<NA>,<NA>,Non-fiction,"Banned in the Soviet Union because it went against the image the Soviet Government tried to project of itself and its policies.[230] However, it has been available in the former Soviet Union since at least the 1980s. In 2009, the Education Ministry of Russia added The Gulag Archipelago to the curriculum for high-school students.[231]",,
Saudi Arabia,<NA>,Queen of Sheba and Biblical Scholarship,Bernard Leeman,,<NA>,<NA>,History,Currently banned in Saudi Arabia for suggesting the Hebrews originated in Yemen and their Israelite successors established their original pre‍–‍586 B.C.E. kingdoms of Israel and Judah between Medina and Yemen.[citation needed],,
Saudi Arabia,<NA>,Goat Days,Benyamin & Joseph Koyippally,2008,<NA>,<NA>,Novel,Currently banned in Saudi Arabia.[232][233],,
Saudi Arabia,<NA>,Fazail-e-Amaal,Zakariyya Kandhlawi,Sometime between the 1920s and 1950s,<NA>,<NA>,Sufi evangalism,Currently banned in Saudi Arabia.[234][235],,
Senegal,<NA>,The Satanic Verses (1988),Salman Rushdie,1988,<NA>,<NA>,Novel,Banned for blasphemy against Islam.[33],,
Singapore,<NA>,"Value, Price and Profit",Karl Marx,1865,<NA>,<NA>,Non‑fiction,Banned under the Internal Security (Prohibition of Publications) (Consolidation) Order.[236],,
Singapore,<NA>,"Origin of Family, Private Property and State",Friedrich Engels,1884,<NA>,<NA>,Non‑fiction,Banned under the Internal Security (Prohibition of Publications) (Consolidation) Order.[236],,
Singapore,<NA>,"One Step Forward, Two Steps Back",Vladimir Lenin,1904,<NA>,<NA>,Non‑fiction,Banned under the Internal Security (Prohibition of Publications) (Consolidation) Order.[236],,
Singapore,<NA>,Theories of Surplus Value,Karl Marx,1905,<NA>,<NA>,Non‑fiction,Banned under the Internal Security (Prohibition of Publications) (Consolidation) Order.[236],,
Singapore,<NA>,Two Tactics of Social Democracy in the Democratic Revolution,Vladimir Lenin,1905,<NA>,<NA>,Non‑fiction,Banned under the Internal Security (Prohibition of Publications) (Consolidation) Order.[236],,
Singapore,<NA>,Anarchism or Socialism?,Joseph Stalin,1907,<NA>,<NA>,Non‑fiction,Banned under the Internal Security (Prohibition of Publications) (Consolidation) Order.[236],,
Singapore,<NA>,Fundamental Problems of Marxism,Georgi Plekhanov,1908,<NA>,<NA>,Political pamphlet,Banned under the Internal Security (Prohibition of Publications) (Consolidation) Order.[236],,
Singapore,<NA>,Heroines of the Modern Progress,Elmer C. Adams,1913,<NA>,<NA>,Non-fiction,Banned under the Internal Security (Prohibition of Publications) (Consolidation) Order.[236],,
Singapore,<NA>,The Right of Nations to Self-Determination,Vladimir Lenin,1914,<NA>,<NA>,Non-fiction,Banned under the Internal Security (Prohibition of Publications) (Consolidation) Order.[236],,
Singapore,<NA>,What Is to Be Done?,Vladimir Lenin,1917,<NA>,<NA>,Non-fiction,Banned under the Internal Security (Prohibition of Publications) (Consolidation) Order.[236],,
Singapore,<NA>,"Imperialism, the Highest Stage of Capitalism",Vladimir Lenin,1917,<NA>,<NA>,Non-fiction,Banned under the Internal Security (Prohibition of Publications) (Consolidation) Order.[236],,
Singapore,<NA>,State and Revolution,Vladimir Lenin,1917,<NA>,<NA>,Non-fiction,Banned under the Internal Security (Prohibition of Publications) (Consolidation) Order.[236],,
Singapore,<NA>,The Proletarian Revolution and the Renegade Kautsky,Vladimir Lenin,1918,<NA>,<NA>,Non-fiction,Banned under the Internal Security (Prohibition of Publications) (Consolidation) Order.[236],,
Singapore,<NA>,Friedrich Engels: A Biography,Gustav Mayer,1920,<NA>,<NA>,Biography,Banned under the Internal Security (Prohibition of Publications) (Consolidation) Order.[236],,
Singapore,<NA>,"""Left-Wing"" Communism: An Infantile Disorder",Vladimir Lenin,1920,<NA>,<NA>,Non‑fiction,Banned under the Internal Security (Prohibition of Publications) (Consolidation) Order.[236],,
Singapore,<NA>,On Cooperation,Vladimir Lenin,1923,<NA>,<NA>,Non‑fiction,Banned under the Internal Security (Prohibition of Publications) (Consolidation) Order.[236],,
Singapore,<NA>,Problems of Leninism,Joseph Stalin,1926,<NA>,<NA>,Non‑fiction,Banned under the Internal Security (Prohibition of Publications) (Consolidation) Order.[236],,
Singapore,<NA>,"Time, Forward!",Valentin Kataev,1932,<NA>,<NA>,Novel,Banned under the Internal Security (Prohibition of Publications) (Consolidation) Order.[236],,
Singapore,<NA>,How the Steel Was Tempered,Nikolai Ostrovsky,1936,<NA>,<NA>,Novel,Banned under the Internal Security (Prohibition of Publications) (Consolidation) Order.[236],,
Singapore,<NA>,Marxism and the National and Colonial Question,Joseph Stalin,1937,<NA>,<NA>,Non-fiction,Banned under the Internal Security (Prohibition of Publications) (Consolidation) Order.[236],,
Singapore,<NA>,Combat Liberalism,Mao Zedong,1937,<NA>,<NA>,Non-fiction,Banned under the Internal Security (Prohibition of Publications) (Consolidation) Order.[236],,
Singapore,<NA>,The A to Z of the Soviet Union,Alex Page,1946,<NA>,<NA>,Non-fiction,Banned under the Internal Security (Prohibition of Publications) (Consolidation) Order.[236],,
Singapore,<NA>,Aspects of China's Anti-Japanese Struggle,Mao Zedong,1948,<NA>,<NA>,Non-fiction,Banned under the Internal Security (Prohibition of Publications) (Consolidation) Order.[236],,
Singapore,<NA>,The Case for Communism,William Gallacher,1949,<NA>,<NA>,Non-fiction,Banned under the Internal Security (Prohibition of Publications) (Consolidation) Order.[236],,
Singapore,<NA>,Twilight of World Capitalism,William Z. Foster,1949,<NA>,<NA>,Non-fiction,Banned under the Internal Security (Prohibition of Publications) (Consolidation) Order.[236],,
Singapore,<NA>,Concerning Marxism in Linguistics,Joseph Stalin,1950,<NA>,<NA>,Non-fiction,Banned under the Internal Security (Prohibition of Publications) (Consolidation) Order.[236],,
Singapore,<NA>,The Social and State Structure of the USSR,Alexander Karpinsky,1952,<NA>,<NA>,Non-fiction,Banned under the Internal Security (Prohibition of Publications) (Consolidation) Order.[236],,
Singapore,<NA>,The Satanic Verses,Salman Rushdie,1988,<NA>,<NA>,Novel,Banned in 1989 for blasphemy against Islam.[33][237],,
Singapore,<NA>,What Islam Is All About,Yahiya Emerick,1997,<NA>,<NA>,Religious education,"Banned in 2018 for ""promoting enmity among different religious communities"".[238][239][240]",,
Singapore,<NA>,The Wisdom of Jihad,Abuhuraira Abdurrahman,2005,<NA>,<NA>,Non-fiction,"Banned in 2018 for ""promoting enmity among different religious communities"".[238][239][240]",,
Singapore,<NA>,Things that Nullify One's Islaam,Shaykh al‑Islaam Muhammad ibn 'Abdil‑Wahhaab,2013,<NA>,<NA>,Non-fiction,"Banned in 2018 for ""promoting enmity among different religious communities"".[238][239][240]",,
Singapore,<NA>,Red Lines: Political Cartoons and the Struggle Against Censorship,Cherian George and Sonny Liew,2021,<NA>,<NA>,Non-fiction,Banned in 2021 for offensive content against Muslims.[241],,
South Africa,<NA>,Frankenstein (1818),Mary Shelley,1818,<NA>,<NA>,Novel,"Banned in apartheid South Africa in 1955 for containing ""obscene"" or ""indecent"" material.[160]",,
South Africa,<NA>,"""The Lottery"" (1948)",Shirley Jackson,1948,<NA>,<NA>,Short story,Banned in South Africa during Apartheid.[242],,
South Africa,<NA>,Lolita (1955),Vladimir Nabokov,1955,<NA>,<NA>,Novel,"Banned for being ""obscene"".[2]",,
South Africa,<NA>,A World of Strangers,Nadine Gordimer,1958,<NA>,<NA>,Novel,Banned in South Africa because of its criticism of Apartheid.[243],,
South Africa,<NA>,Why We Can't Wait,Martin Luther King Jr.,1964,<NA>,<NA>,Non-fiction,Banned in South Africa because of its criticism of white supremacy.[244],,
South Africa,<NA>,The First Book of Africa,Langston Hughes,1964,<NA>,<NA>,Non‑fiction; Children's book,Banned in South Africa for its celebration of Black African culture.[244],,
South Africa,<NA>,The Autobiography of Malcolm X,Malcolm X with Alex Haley,1965,<NA>,<NA>,Non-fiction,Banned in South Africa because of its criticism of white supremacy.[244],,
South Africa,<NA>,Black Power: The Politics of Liberation,Stokely Carmichael and Charles V. Hamilton,1967,<NA>,<NA>,Non-fiction,Banned in South Africa because of its criticism of white supremacy.[244],,
South Africa,<NA>,Soul on Ice,Eldridge Cleaver,1968,<NA>,<NA>,Non-fiction,"Banned in South Africa because of its criticism of white supremacy, and its sexual content.[244]",,
South Africa,<NA>,The Satanic Bible (1969),Anton LaVey,1969,<NA>,<NA>,Religious text,Banned during apartheid in South Africa from 1973 to 1993 for moral reasons.[245],,
South Africa,<NA>,The Struggle Is My Life,Nelson Mandela,1978,<NA>,<NA>,Non-fiction,Banned in Apartheid South Africa until 1990.[246],,
South Africa,<NA>,Burger's Daughter,Nadine Gordimer,1979,<NA>,<NA>,Novel,Banned in South Africa in July 1979 for going against the government's racial policies; the ban was reversed in October of the same year.[163],,
South Africa,<NA>,July's People (1981),Nadine Gordimer,1981,<NA>,<NA>,Novel,Banned during the Apartheid-era in South Africa.[247] July's People is now included in the South African school curriculum.[248],,
South Korea,<NA>,Year 501: The Conquest Continues,Noam Chomsky,<NA>,<NA>,<NA>,Politics,"Banned from distribution within the South Korean military as part of 23 books banned on August 1, 2008, by the South Korean Ministry of National Defense in response to intelligence suggesting a book‑distribution campaign to active‑duty soldiers by the pro‍–‍North Korean Hanchongnyon.[249] The books were classified into three categories: 11 for praise of North Korea, 10 for anti‑government/anti‑American content, and two for anti‑capitalism.[250][251]",,2000.0
South Korea,<NA>,What Uncle Sam Really Wants,Noam Chomsky,<NA>,<NA>,<NA>,Politics,"Banned from distribution within the South Korean military as part of 23 books banned on August 1, 2008, by the South Korean Ministry of National Defense in response to intelligence suggesting a book‑distribution campaign to active‑duty soldiers by the pro‍–‍North Korean Hanchongnyon.[249] The books were classified into three categories: 11 for praise of North Korea, 10 for anti‑government/anti‑American content, and two for anti‑capitalism.[250][251]",,2007.0
South Korea,<NA>,Guerillas of the Kingdom of Samsung,Pressian,<NA>,<NA>,<NA>,Politics,"Banned from distribution within the South Korean military as part of 23 books banned on August 1, 2008, by the South Korean Ministry of National Defense in response to intelligence suggesting a book‑distribution campaign to active‑duty soldiers by the pro‍–‍North Korean Hanchongnyon.[249] The books were classified into three categories: 11 for praise of North Korea, 10 for anti‑government/anti‑American content, and two for anti‑capitalism.[250][251]",,2008.0
South Korea,<NA>,Auf Der Universität,Theodor Storm,<NA>,<NA>,<NA>,Politics,"Banned from distribution within the South Korean military as part of 23 books banned on August 1, 2008, by the South Korean Ministry of National Defense in response to intelligence suggesting a book‑distribution campaign to active‑duty soldiers by the pro‍–‍North Korean Hanchongnyon.[249] The books were classified into three categories: 11 for praise of North Korea, 10 for anti‑government/anti‑American content, and two for anti‑capitalism.[250][251]",,1999.0
South Korea,<NA>,The Global Trap,Hans-Peter Martin and Harald Schumann,<NA>,<NA>,<NA>,Politics,"Banned from distribution within the South Korean military as part of 23 books banned on August 1, 2008, by the South Korean Ministry of National Defense in response to intelligence suggesting a book‑distribution campaign to active‑duty soldiers by the pro‍–‍North Korean Hanchongnyon.[249] The books were classified into three categories: 11 for praise of North Korea, 10 for anti‑government/anti‑American content, and two for anti‑capitalism.[250][251]",,2003.0
South Korea,<NA>,Bad Samaritans: The Myth of Free Trade and the Secret History of Capitalism,Ha-Joon Chang,<NA>,<NA>,<NA>,Non‑fiction,"Banned from distribution within the South Korean military as part of 23 books banned on August 1, 2008, by the South Korean Ministry of National Defense in response to intelligence suggesting a book‑distribution campaign to active‑duty soldiers by the pro‍–‍North Korean Hanchongnyon.[249] The books were classified into three categories: 11 for praise of North Korea, 10 for anti‑government/anti‑American content, and two for anti‑capitalism.[250][251]",,2007.0
South Korea,<NA>,One Spoon on This Earth,Hyun Ki-young,<NA>,<NA>,<NA>,Novel,"Banned from distribution within the South Korean military as part of 23 books banned on August 1, 2008, by the South Korean Ministry of National Defense in response to intelligence suggesting a book‑distribution campaign to active‑duty soldiers by the pro‍–‍North Korean Hanchongnyon.[249] The books were classified into three categories: 11 for praise of North Korea, 10 for anti‑government/anti‑American content, and two for anti‑capitalism.[250][251]",,1999.0
South Korea,<NA>,Slots,Shin Gyeong-jin,<NA>,<NA>,<NA>,Novel,"Banned as part of 19 books added in August 2011 to the 2008 banned book list, all belonging to the 'anti‑capitalism' category.[252]",,2007.0
South Korea,<NA>,Respect: Everything a Guy Needs to Know About Sex,Inti Chavez Perez,<NA>,<NA>,<NA>,Non‑fiction,"Banned from distribution to readers below the age of 19 through schools, libraries and book stores in 2024 by the South Korean Ministry of Culture, Sports and Tourism. The book was reported to authorities as part of a campaign against books on sex education.[253]",,2020.0
Spain,<NA>,Works,Johannes Kepler,1596–1634,<NA>,<NA>,Non-fiction,Banned by Habsburg Monarchy of Spain for perceived heresy.[254],,
Spain,<NA>,Works,Voltaire,1727–1778,<NA>,<NA>,"Novels, Plays, Non-fiction","Voltaire's entire body of work was banned by the Bourbon Monarchy of Spain, after it was condemned by the Spanish Inquisition.[255]",,
Spain,<NA>,Works,Vicente Blasco Ibáñez,1892–1928,<NA>,<NA>,"Novels, Non‑fiction",All of Blasco Ibáñez's books were banned by the Franco government in 1939.[256],,
Spain,<NA>,A Short History of the World,H. G. Wells,1922,<NA>,<NA>,Non-fiction,"An expanded, Spanish‑language translation of A Short History of the World, discussing recent world events, was banned by Spanish censors in 1940. This edition of A Short History was not published in Spain until 1963. In two 1948 reports, Spanish censors gave a list of objections to the books's publication. These were that the book ""shows socialist inclinations, attacks the Catholic Church, gives a twisted interpretation of the Spanish Civil War and the Spanish National Movement, and contains 'tortuous concepts'.""[257]",,
Spain,<NA>,Ulysses,James Joyce,1922,<NA>,<NA>,Novel,The complete 1945 Spanish‑language translation of Ulysses was suppressed by the Spanish authorities until 1962.[258],,
Spain,<NA>,The Story of Ferdinand,Munro Leaf,1936,<NA>,<NA>,Children's fiction,Banned in Francoist Spain.[131],,
Spain,<NA>,Homage to Catalonia,George Orwell,1938,<NA>,<NA>,Non-fiction,Banned in Francoist Spain for its support of the Republican faction during the Spanish Civil War.[259],,
Spain,<NA>,For Whom the Bell Tolls,Ernest Hemingway,1940,<NA>,<NA>,Novel,Suppressed by the Spanish authorities until 1968.[260],,
Spain,<NA>,Works,Federico García Lorca,1939,<NA>,<NA>,"Poetry, drama",Banned until 1954; published in Argentina.[261],,
Spain,<NA>,You Can't Be Too Careful,H. G. Wells,1941,<NA>,<NA>,Novel,"Banned in Francoist Spain for criticizing Christianity, and for mentioning the Bombing of Guernica by the Axis air forces.[262]",,
Spain,<NA>,The Spanish Labyrinth,Gerald Brenan,1943,<NA>,<NA>,Non-fiction,Banned in Francoist Spain because of its strong criticism of the Nationalist Faction's actions during the Spanish Civil War.[263],,
Spain,<NA>,The Second Sex,Simone de Beauvoir,1949,<NA>,<NA>,Non-fiction,Banned in Francoist Spain for its advocacy of feminism.[264],,
Spain,<NA>,The Hive,Camilo José Cela,1950,<NA>,<NA>,Fiction,Banned by censors of Francoist Spain.[265],,
Spain,<NA>,The Spanish Civil War,Hugh Thomas,1961,<NA>,<NA>,Non-fiction,"Banned by censors of Francoist Spain for its negative depiction of the Nationalist Faction during the Civil War, and its critique of the Franco regime.[266]",,
Spain,<NA>,The Death of Lorca,Ian Gibson,1971,<NA>,<NA>,Biography,Banned briefly in Spain.[267],,
Sri Lanka,<NA>,The Satanic Verses (1988),Salman Rushdie,1988,<NA>,<NA>,Novel,Banned for blasphemy against Islam.[33],,
Tanzania,<NA>,The Satanic Verses (1988),Salman Rushdie,1988,<NA>,<NA>,Novel,Banned for blasphemy against Islam.[33],,
Taiwan,<NA>,Various works,Shen Congwen,1902–1988,<NA>,<NA>,Novels,"""Denounced by the Communists and Nationalists alike, Mr. Shen saw his writings banned in Taiwan, while mainland China publishing houses burned his books and destroyed printing plates for his novels.""[268]",,
Thailand,<NA>,The Devil's Discus,Rayne Kruger,1964,<NA>,<NA>,Non-fiction,Banned in Thailand in 2006 for violating the country's lese-majesté rules through its discussion of the murder of Thailand's king in 1946.[269][further explanation needed],,
Thailand,<NA>,The Satanic Verses (1988),Salman Rushdie,1988,<NA>,<NA>,Novel,Banned for blasphemy against Islam.[33],,
Thailand,<NA>,The King Never Smiles (2006),Paul M. Handley,2006,<NA>,<NA>,Biography,Banned in Thailand for its criticism of King Bhumibol Adulyadej.[270],,
Thailand,<NA>,Rama X: The Thai Monarchy under King Vajiralongkorn (2006),Pavin Chachavalpongpun,2024,<NA>,<NA>,Biography,Banned in Thailand for its criticism of King Vajiralongkorn.[271],,
Uganda,<NA>,The Greedy Barbarian,Kakwenza Rukirabashaija,2020,<NA>,<NA>,Novel,Satirical novel which describes high-level corruption in a fictional country.[272],,
Uganda,<NA>,From Third World to First,Lee Kuan Yew,2000,<NA>,<NA>,Memoir,,,
Uganda,<NA>,Betrayed By My Leader,John Kazoora,2012,<NA>,<NA>,Memoir,Kazoora provides insight into the events that led to the severance of ties with President Museveni and the National Resistance Movement[273],,
